{
  "claim_boundary": "More observations do not imply broader coverage. Reported source coordinates and canonical EPSG:4326 coverage are separate; independent lineage, sample type, method and region must be interpreted together.",
  "coverage_balance_version": "d1-v4-medium-balance-v1",
  "denominator_definition": "full-cache target observations; sample IDs are deduplicated within source, not across sources",
  "media": {
    "rock": {
      "comparable_observation_count": 0,
      "covered_spatial_cells": 0,
      "distinct_sample_count": 25972,
      "independent_lineage_count": 1,
      "lineage_ids": [
        "georoc-compilation"
      ],
      "observation_count": 67171,
      "reported_comparable_observation_count": 0,
      "reported_coordinate_sample_count": 21178,
      "reported_covered_spatial_cells": 413,
      "source_ids": [
        "georoc-antarctica-intraplate",
        "georoc-archaean"
      ],
      "spatial_grid": "canonical EPSG:4326 1-degree floor cell; no interpolation",
      "valid_coordinate_sample_count": 0
    },
    "sediment": {
      "comparable_observation_count": 22840,
      "covered_spatial_cells": 641,
      "distinct_sample_count": 12831,
      "independent_lineage_count": 6,
      "lineage_ids": [
        "australia-ngsa-mercury",
        "foregs-geochemical-atlas-europe-2005",
        "japan-gsj-geochemical-map",
        "japan-gsj-marine-sediment",
        "norway-marchem",
        "pangaea-arabian-sea-sediment"
      ],
      "observation_count": 82282,
      "reported_comparable_observation_count": 22840,
      "reported_coordinate_sample_count": 12831,
      "reported_covered_spatial_cells": 1313,
      "source_ids": [
        "australia-ngsa-mercury",
        "foregs-floodplain-sediment",
        "foregs-stream-sediment",
        "japan-gsj-geochemical-map",
        "japan-gsj-marine-sediment",
        "norway-marchem",
        "pangaea-arabian-sea-sediment"
      ],
      "spatial_grid": "canonical EPSG:4326 1-degree floor cell; no interpolation",
      "valid_coordinate_sample_count": 2507
    },
    "soil": {
      "comparable_observation_count": 76915,
      "covered_spatial_cells": 1419,
      "distinct_sample_count": 23914,
      "independent_lineage_count": 6,
      "lineage_ids": [
        "afsis-phase-i-wet-chemistry",
        "foregs-geochemical-atlas-europe-2005",
        "gemas-europe",
        "pangaea-north-africa-soil",
        "tpdc-china-mountain-soil",
        "usgs-conus-soil"
      ],
      "observation_count": 153781,
      "reported_comparable_observation_count": 76915,
      "reported_coordinate_sample_count": 23788,
      "reported_covered_spatial_cells": 1851,
      "source_ids": [
        "afsis-phase-i-wet-chemistry",
        "foregs-humus",
        "foregs-subsoil",
        "foregs-topsoil",
        "gemas-europe",
        "pangaea-north-africa-soil",
        "tpdc-china-mountain-soil",
        "usgs-conus-soil"
      ],
      "spatial_grid": "canonical EPSG:4326 1-degree floor cell; no interpolation",
      "valid_coordinate_sample_count": 20598
    },
    "water": {
      "comparable_observation_count": 284073,
      "covered_spatial_cells": 2440,
      "distinct_sample_count": 708605,
      "independent_lineage_count": 4,
      "lineage_ids": [
        "foregs-geochemical-atlas-europe-2005",
        "gemstat-open-archive",
        "geotraces-idp2025",
        "us-wqp-sacramento-river-arsenic"
      ],
      "observation_count": 3783544,
      "reported_comparable_observation_count": 284073,
      "reported_coordinate_sample_count": 708605,
      "reported_covered_spatial_cells": 2440,
      "source_ids": [
        "foregs-stream-water",
        "gemstat-open-archive",
        "geotraces-idp2025",
        "us-wqp-sacramento-river-arsenic"
      ],
      "spatial_grid": "canonical EPSG:4326 1-degree floor cell; no interpolation",
      "valid_coordinate_sample_count": 708416
    }
  },
  "medium_elements": {
    "rock|As": {
      "comparable_observation_count": 0,
      "covered_spatial_cells": 0,
      "distinct_sample_count": 4503,
      "element": "As",
      "independent_lineage_count": 1,
      "lineage_ids": [
        "georoc-compilation"
      ],
      "medium": "rock",
      "observation_count": 4780,
      "reported_comparable_observation_count": 0,
      "reported_coordinate_sample_count": 4221,
      "reported_covered_spatial_cells": 97,
      "source_ids": [
        "georoc-antarctica-intraplate",
        "georoc-archaean"
      ],
      "spatial_grid": "canonical EPSG:4326 1-degree floor cell; no interpolation",
      "valid_coordinate_sample_count": 0
    },
    "rock|Cr": {
      "comparable_observation_count": 0,
      "covered_spatial_cells": 0,
      "distinct_sample_count": 241,
      "element": "Cr",
      "independent_lineage_count": 1,
      "lineage_ids": [
        "georoc-compilation"
      ],
      "medium": "rock",
      "observation_count": 241,
      "reported_comparable_observation_count": 0,
      "reported_coordinate_sample_count": 240,
      "reported_covered_spatial_cells": 14,
      "source_ids": [
        "georoc-antarctica-intraplate"
      ],
      "spatial_grid": "canonical EPSG:4326 1-degree floor cell; no interpolation",
      "valid_coordinate_sample_count": 0
    },
    "rock|Cu": {
      "comparable_observation_count": 0,
      "covered_spatial_cells": 0,
      "distinct_sample_count": 17630,
      "element": "Cu",
      "independent_lineage_count": 1,
      "lineage_ids": [
        "georoc-compilation"
      ],
      "medium": "rock",
      "observation_count": 18077,
      "reported_comparable_observation_count": 0,
      "reported_coordinate_sample_count": 14405,
      "reported_covered_spatial_cells": 329,
      "source_ids": [
        "georoc-antarctica-intraplate",
        "georoc-archaean"
      ],
      "spatial_grid": "canonical EPSG:4326 1-degree floor cell; no interpolation",
      "valid_coordinate_sample_count": 0
    },
    "rock|Ni": {
      "comparable_observation_count": 0,
      "covered_spatial_cells": 0,
      "distinct_sample_count": 25405,
      "element": "Ni",
      "independent_lineage_count": 1,
      "lineage_ids": [
        "georoc-compilation"
      ],
      "medium": "rock",
      "observation_count": 25955,
      "reported_comparable_observation_count": 0,
      "reported_coordinate_sample_count": 20746,
      "reported_covered_spatial_cells": 404,
      "source_ids": [
        "georoc-antarctica-intraplate",
        "georoc-archaean"
      ],
      "spatial_grid": "canonical EPSG:4326 1-degree floor cell; no interpolation",
      "valid_coordinate_sample_count": 0
    },
    "rock|Pb": {
      "comparable_observation_count": 0,
      "covered_spatial_cells": 0,
      "distinct_sample_count": 276,
      "element": "Pb",
      "independent_lineage_count": 1,
      "lineage_ids": [
        "georoc-compilation"
      ],
      "medium": "rock",
      "observation_count": 276,
      "reported_comparable_observation_count": 0,
      "reported_coordinate_sample_count": 276,
      "reported_covered_spatial_cells": 17,
      "source_ids": [
        "georoc-antarctica-intraplate"
      ],
      "spatial_grid": "canonical EPSG:4326 1-degree floor cell; no interpolation",
      "valid_coordinate_sample_count": 0
    },
    "rock|Zn": {
      "comparable_observation_count": 0,
      "covered_spatial_cells": 0,
      "distinct_sample_count": 17412,
      "element": "Zn",
      "independent_lineage_count": 1,
      "lineage_ids": [
        "georoc-compilation"
      ],
      "medium": "rock",
      "observation_count": 17842,
      "reported_comparable_observation_count": 0,
      "reported_coordinate_sample_count": 14234,
      "reported_covered_spatial_cells": 328,
      "source_ids": [
        "georoc-antarctica-intraplate",
        "georoc-archaean"
      ],
      "spatial_grid": "canonical EPSG:4326 1-degree floor cell; no interpolation",
      "valid_coordinate_sample_count": 0
    },
    "sediment|As": {
      "comparable_observation_count": 4100,
      "covered_spatial_cells": 641,
      "distinct_sample_count": 10435,
      "element": "As",
      "independent_lineage_count": 5,
      "lineage_ids": [
        "foregs-geochemical-atlas-europe-2005",
        "japan-gsj-geochemical-map",
        "japan-gsj-marine-sediment",
        "norway-marchem",
        "pangaea-arabian-sea-sediment"
      ],
      "medium": "sediment",
      "observation_count": 12029,
      "reported_comparable_observation_count": 4100,
      "reported_coordinate_sample_count": 10435,
      "reported_covered_spatial_cells": 768,
      "source_ids": [
        "foregs-floodplain-sediment",
        "foregs-stream-sediment",
        "japan-gsj-geochemical-map",
        "japan-gsj-marine-sediment",
        "norway-marchem",
        "pangaea-arabian-sea-sediment"
      ],
      "spatial_grid": "canonical EPSG:4326 1-degree floor cell; no interpolation",
      "valid_coordinate_sample_count": 2507
    },
    "sediment|Cr": {
      "comparable_observation_count": 3220,
      "covered_spatial_cells": 566,
      "distinct_sample_count": 9555,
      "element": "Cr",
      "independent_lineage_count": 4,
      "lineage_ids": [
        "foregs-geochemical-atlas-europe-2005",
        "japan-gsj-geochemical-map",
        "japan-gsj-marine-sediment",
        "pangaea-arabian-sea-sediment"
      ],
      "medium": "sediment",
      "observation_count": 11149,
      "reported_comparable_observation_count": 3220,
      "reported_coordinate_sample_count": 9555,
      "reported_covered_spatial_cells": 693,
      "source_ids": [
        "foregs-floodplain-sediment",
        "foregs-stream-sediment",
        "japan-gsj-geochemical-map",
        "japan-gsj-marine-sediment",
        "pangaea-arabian-sea-sediment"
      ],
      "spatial_grid": "canonical EPSG:4326 1-degree floor cell; no interpolation",
      "valid_coordinate_sample_count": 1627
    },
    "sediment|Cu": {
      "comparable_observation_count": 4100,